{
  "run_id": "20260822-062538-untitled-creative-spurt",
  "title": "Untitled creative spurt",
  "question": "A first test brief, now edited inline from the inspector.",
  "created": "2026-08-22T06:25:38.136Z",
  "created_by": "directors-cut-bridge",
  "status": "running",
  "models_requested": [
    "Claude",
    "ChatGPT"
  ],
  "target_models": [
    "sora-2"
  ],
  "tags": [
    "raycast",
    "creative_concept",
    "sora_12s"
  ]
}
