{
  "run_id": "2026-07-netflix-teaser-title-slam-001",
  "title": "THE GLASS HOUSE — Netflix Teaser Title Slam Comparison",
  "question": "Create a Netflix-style supernatural thriller teaser called THE GLASS HOUSE with one eerie location beat, one human reaction beat, one symbolic impact/action beat, and a final hard title-card/title-slam moment.",
  "created": "2026-07-09T00:00:00Z",
  "created_by": "hermes",
  "status": "answers_collected",
  "models_requested": [
    "Raycast Auto",
    "Seedance 2.0",
    "Sora"
  ],
  "target_models": [
    "nano_banana_2",
    "seedance_2_0"
  ],
  "tags": [
    "netflix_teaser",
    "title_slam",
    "glass_house",
    "generation"
  ]
}