{
  "run_id": "2026-07-sora-vice-teaser-001",
  "title": "Sora 2 Vice-style teaser prompts — text-only 720p",
  "question": "Create two Sora 2 text-to-video 720p teaser prompts inspired by Gordo's successful Sora examples and Vice/High Society/War on Drugs style underground-community documentary topics. File prompts and generation artifacts into the Directors Cut comparison database.",
  "created": "2026-07-10T00:03:12Z",
  "created_by": "hermes",
  "status": "answers_collected",
  "models_requested": [
    "Sora 2",
    "Sora 2"
  ],
  "target_models": [
    "sora-2"
  ],
  "tags": [
    "sora",
    "vice",
    "nightlife",
    "high_society",
    "text_to_video",
    "720p"
  ]
}