{
  "run_id": "20260818-180320-checkout-teaser",
  "title": "Checkout - Teaser",
  "question": "PROJECT TITLE\nCheckout - Teaser\n\nCREATIVE BRIEF\nDevelop two independent premium trailer concepts from this idea for a young-adult audience. ChatGPT and Claude will each receive the same brief through Raycast.\n\nCreate a 12-second supernatural-thriller teaser set in a luxury coastal hotel during a hurricane evacuation. A night concierge sees the same unknown guest on every security monitor. Elevator doors open onto black ocean water. End on a hard title reveal: CHECKOUT.\n\nDELIVERY\n- Exactly one open-ended, high-paced 12-second Sora sizzler prompt per model\n- The writing, imagery, action, sound, music, rhythm, and title impact are one integrated video prompt\n- World-building may be slightly futuristic, fantasy, period, or pre-AI 2000s when it serves the concept\n- Prioritize an immediate hook, emotional discovery, and a sharp plot-turn payoff\n- Include intentional audio, music, ambience, dialogue, and SFX direction inside the prompt\n- Do not return a shot list, multiple prompt options, or claim a video was generated\n- No visual reference supplied.\n\nRAYCAST WORKFLOW\nRun “Start Trailer Feed Concept Run.” Enter the project title as argument 1 and leave argument 2 blank to use this copied brief. The command saves the project, rebuilds the Projects index, and copies the canonical prompt for ChatGPT; capture ChatGPT, then repeat with Claude.",
  "created": "2026-08-18T18:03:20.143Z",
  "created_by": "trailer-feed-bridge",
  "status": "generation_partial",
  "models_requested": [
    "ChatGPT",
    "Claude"
  ],
  "target_models": [
    "sora-2"
  ],
  "tags": [
    "raycast",
    "creative_concept",
    "sora_12s"
  ]
}
